decompose-k/bench_results/plain_matmul_bf16.csv
suite,m,n,k,dtype,eager_ms,compiled_ms,custom_op_mm_ms,custom_op_speedup_vs_eager,custom_op_speedup_vs_compiled,decompose_k_ms,decompose_k_speedup_vs_eager,decompose_k_speedup_vs_compiled,split_k,block_m,block_n,block_k
matmul-bf16,16,16,8192,bfloat16,0.011359999887645245,0.009503999724984169,0.00886400043964386,1.2815883714127692,1.0722020818588793,0.009279999881982803,1.2241379344951047,1.0241379144234972,32,16,16,128
matmul-bf16,16,16,12288,bfloat16,0.011711999773979187,0.009824000298976898,0.008927999995648861,1.311827932312627,1.1003584569628932,0.009696000255644321,1.207920736920494,1.0132013242530666,48,16,16,128
matmul-bf16,16,16,16384,bfloat16,0.01190400030463934,0.010080000385642052,0.009151999838650227,1.3006993569172733,1.1013986629537234,0.010111999697983265,1.1772152551600126,0.9968355109476916,32,16,16,128
matmul-bf16,16,16,20480,bfloat16,0.012384000234305859,0.01027199998497963,0.009696000255644321,1.2772277132621541,1.059405911112678,0.010432000271975994,1.187116555927785,0.9846625495758295,40,16,16,128
matmul-bf16,16,16,24576,bfloat16,0.012415999546647072,0.010623999871313572,0.009535999968647957,1.3020133795582898,1.1140939498996114,0.010751999914646149,1.1547618717643644,0.9880952339705456,48,16,16,128
matmul-bf16,16,16,28672,bfloat16,0.012736000120639801,0.010623999871313572,0.009855999611318111,1.2922078554076288,1.077922107374429,0.01104000024497509,1.1536231737346794,0.9623188075696952,56,16,16,128
matmul-bf16,16,16,32768,bfloat16,0.012608000077307224,0.010623999871313572,0.010048000141978264,1.2547770600274837,1.0573248130171606,0.011071999557316303,1.1387283762105953,0.9595375989961366,64,16,16,128
matmul-bf16,32,32,8192,bfloat16,0.011807999573647976,0.010143999941647053,0.009216000325977802,1.2812499084189395,1.100694399180242,0.009759999811649323,1.2098360452378498,1.0393442763737963,32,16,16,128
matmul-bf16,32,32,12288,bfloat16,0.012223999947309494,0.010208000428974628,0.009696000255644321,1.2607260339327602,1.052805297012266,0.010367999784648418,1.1790123650860023,0.984567963059693,24,16,16,128
matmul-bf16,32,32,16384,bfloat16,0.012543999589979649,0.010528000071644783,0.010080000385642052,1.2444443561576959,1.0444444115935612,0.010879999957978725,1.1529411432378405,0.9676470691458222,32,16,16,128
matmul-bf16,32,32,20480,bfloat16,0.013088000006973743,0.011071999557316303,0.010623999871313572,1.2319277264218864,1.04216864565411,0.01158399973064661,1.129834281016785,0.9558010889817478,40,16,16,128
matmul-bf16,32,32,24576,bfloat16,0.01321600005030632,0.011136000044643879,0.010816000401973724,1.2218934503640217,1.0295857646798683,0.01190400030463934,1.1102150295775493,0.9354838507777803,48,16,16,128
matmul-bf16,32,32,28672,bfloat16,0.013472000136971474,0.011615999974310398,0.011359999887645245,1.1859155167442537,1.0225352191194623,0.012384000234305859,1.087855287635708,0.9379844763029022,56,16,16,128
matmul-bf16,32,32,32768,bfloat16,0.013728000223636627,0.01152000017464161,0.01158399973064661,1.1850829197896002,0.9944751763213803,0.01235199999064207,1.1113989826778676,0.9326425018919374,32,16,16,128
matmul-bf16,48,48,8192,bfloat16,0.012527999933809042,0.01065600011497736,0.009983999654650688,1.2548077290821342,1.067307740742323,0.010528000071644783,1.1899695904781467,1.0121580587444448,16,16,16,128
matmul-bf16,48,48,12288,bfloat16,0.012608000077307224,0.011071999557316303,0.011136000044643879,1.1321839104491866,0.9942528298248025,0.01119999960064888,1.1257143327555807,0.9885714242949472,24,16,16,128
matmul-bf16,48,48,16384,bfloat16,0.01283199992030859,0.011392000131309032,0.010816000401973724,1.1863904810845773,1.0532544108661643,0.011839999817311764,1.083783793775603,0.9621621880983737,16,16,16,128
matmul-bf16,48,48,20480,bfloat16,0.013311999849975109,0.011680000461637974,0.011392000131309032,1.1685392992042964,1.025280927581577,0.012319999746978283,1.0805194905332798,0.9480520049931591,20,16,16,128
matmul-bf16,48,48,24576,bfloat16,0.013535999692976475,0.01235199999064207,0.011615999974310398,1.1652892323443778,1.0633608830887904,0.012671999633312225,1.0681818248631385,0.974747502215125,24,16,16,128
matmul-bf16,48,48,28672,bfloat16,0.013919999822974205,0.013919999822974205,0.01206399966031313,1.1538461716611903,1.1538461716611903,0.012992000207304955,1.071428540706724,1.071428540706724,28,16,16,128
matmul-bf16,48,48,32768,bfloat16,0.014112000353634357,0.012864000163972378,0.012319999746978283,1.1454545976833803,1.0441558789096177,0.013919999822974205,1.0137931417458257,0.9241379545667122,32,16,16,128
matmul-bf16,64,64,8192,bfloat16,0.01235199999064207,0.010591999627649784,0.009952000342309475,1.241157512638876,1.0643086076494035,0.010623999871313572,1.1626506156117682,0.9969879288355233,16,32,16,256
matmul-bf16,64,64,12288,bfloat16,0.01283199992030859,0.011392000131309032,0.011296000331640244,1.135977296704391,1.0084985655851915,0.011807999573647976,1.0867208996980222,0.9647696936518076,16,16,16,128
matmul-bf16,64,64,16384,bfloat16,0.013151999562978745,0.011648000217974186,0.01142400037497282,1.151260428158909,1.0196078287507846,0.012480000033974648,1.0538461159595107,0.9333333482583746,16,16,32,256
matmul-bf16,64,64,20480,bfloat16,0.013632000423967838,0.012304000090807676,0.01190400030463934,1.1451612966319438,1.0336021317147015,0.012959999963641167,1.0518518875163538,0.9493827257196084,16,16,32,256
matmul-bf16,64,64,24576,bfloat16,0.013504000380635262,0.012319999746978283,0.012128000147640705,1.1134564822100728,1.0158311013357737,0.013919999822974205,0.9701149822105343,0.8850574643431238,24,16,32,128
matmul-bf16,64,64,28672,bfloat16,0.014240000396966934,0.013120000250637531,0.012640000320971012,1.1265822812790094,1.0379746770156446,0.014112000353634357,1.0090702976279058,0.929705209882499,16,16,32,256
matmul-bf16,64,64,32768,bfloat16,0.014431999996304512,0.013279999606311321,0.013120000250637531,1.0999999787045147,1.0121950726080218,0.014271999709308147,1.0112107826692298,0.930493264910183,16,32,16,256
